{
    "data_format": 1,
    "data_updated": "20251031T132908Z",
    "project": {
        "contact_email": "zkir@zkir.ru",
        "contact_name": "Kirill B. aka Zkir",
        "description": "OSM-based map of Earth land covers",
        "name": "OpenLandcoverMap ;)",
        "project_url": "https://github.com/Zkir/generalized_landcovers"
    },
    "tags": [
        {
            "description": "Rendered as landcover.",
            "key": "landuse",
            "object_types": [
                "area"
            ],
            "value": "allotments"
        },
        {
            "description": "Rendered as landcover.",
            "key": "natural",
            "object_types": [
                "area"
            ],
            "value": "arctic_desert"
        },
        {
            "description": "Rendered as landcover.",
            "key": "natural",
            "object_types": [
                "area"
            ],
            "value": "bare_earth"
        },
        {
            "description": "Rendered as landcover.",
            "key": "natural",
            "object_types": [
                "area"
            ],
            "value": "bare_rock"
        },
        {
            "description": "Rendered as landcover.",
            "key": "natural",
            "object_types": [
                "area"
            ],
            "value": "beach"
        },
        {
            "description": "Rendered as landcover.",
            "key": "natural",
            "object_types": [
                "area"
            ],
            "value": "blockfield"
        },
        {
            "description": "Rendered as landcover.",
            "key": "landuse",
            "object_types": [
                "area"
            ],
            "value": "cemetery"
        },
        {
            "description": "Rendered as landcover.",
            "key": "natural",
            "object_types": [
                "area"
            ],
            "value": "desert"
        },
        {
            "description": "Accepted as landcover, but not rendered.",
            "key": "natural",
            "object_types": [
                "area"
            ],
            "value": "drainage_basin"
        },
        {
            "description": "Rendered as landcover.",
            "key": "landuse",
            "object_types": [
                "area"
            ],
            "value": "farmland"
        },
        {
            "description": "Rendered as landcover.",
            "key": "landuse",
            "object_types": [
                "area"
            ],
            "value": "farmyard"
        },
        {
            "description": "Rendered as landcover.",
            "key": "natural",
            "object_types": [
                "area"
            ],
            "value": "glacier"
        },
        {
            "description": "Accepted as landcover, but not rendered.",
            "key": "landuse",
            "object_types": [
                "area"
            ],
            "value": "government"
        },
        {
            "description": "Rendered as landcover.",
            "key": "natural",
            "object_types": [
                "area"
            ],
            "value": "grassland"
        },
        {
            "description": "Rendered as landcover.",
            "key": "landuse",
            "object_types": [
                "area"
            ],
            "value": "greenhouse_horticulture"
        },
        {
            "description": "Rendered as landcover.",
            "key": "natural",
            "object_types": [
                "area"
            ],
            "value": "heath"
        },
        {
            "description": "Accepted as landcover, but not rendered.",
            "key": "landuse",
            "object_types": [
                "area"
            ],
            "value": "inundation_area"
        },
        {
            "description": "Accepted as landcover, but not rendered.",
            "key": "landuse",
            "object_types": [
                "area"
            ],
            "value": "irrigation_district"
        },
        {
            "description": "Rendered as landcover.",
            "key": "landuse",
            "object_types": [
                "area"
            ],
            "value": "landfill"
        },
        {
            "description": "Rendered as landcover.",
            "key": "landuse",
            "object_types": [
                "area"
            ],
            "value": "logging"
        },
        {
            "description": "Accepted as landcover, but not rendered.",
            "key": "landuse",
            "object_types": [
                "area"
            ],
            "value": "logistics"
        },
        {
            "description": "Rendered as landcover.",
            "key": "landuse",
            "object_types": [
                "area"
            ],
            "value": "meadow"
        },
        {
            "description": "Accepted as landcover, but not rendered.",
            "key": "landuse",
            "object_types": [
                "area"
            ],
            "value": "mine"
        },
        {
            "description": "Rendered as landcover.",
            "key": "natural",
            "object_types": [
                "area"
            ],
            "value": "moor"
        },
        {
            "description": "Rendered as landcover.",
            "key": "natural",
            "object_types": [
                "area"
            ],
            "value": "mud"
        },
        {
            "description": "Accepted as landcover, but not rendered.",
            "key": "landuse",
            "object_types": [
                "area"
            ],
            "value": "oil_field"
        },
        {
            "description": "Accepted as landcover, but not rendered.",
            "key": "landuse",
            "object_types": [
                "area"
            ],
            "value": "oilfield"
        },
        {
            "description": "Rendered as landcover.",
            "key": "landuse",
            "object_types": [
                "area"
            ],
            "value": "orchard"
        },
        {
            "description": "Rendered as landcover.",
            "key": "landuse",
            "object_types": [
                "area"
            ],
            "value": "paddy"
        },
        {
            "description": "Rendered as landcover.",
            "key": "landuse",
            "object_types": [
                "area"
            ],
            "value": "peat_cutting"
        },
        {
            "description": "Rendered as landcover.",
            "key": "landuse",
            "object_types": [
                "area"
            ],
            "value": "plant_nursery"
        },
        {
            "description": "Accepted as landcover, but not rendered.",
            "key": "natural",
            "object_types": [
                "area"
            ],
            "value": "playa"
        },
        {
            "description": "Rendered as landcover.",
            "key": "landuse",
            "object_types": [
                "area"
            ],
            "value": "quarry"
        },
        {
            "description": "Rendered as landcover.",
            "key": "landuse",
            "object_types": [
                "area"
            ],
            "value": "railway"
        },
        {
            "description": "Accepted as landcover, but not rendered.",
            "key": "landuse",
            "object_types": [
                "area"
            ],
            "value": "rangeland"
        },
        {
            "description": "Accepted as landcover, but not rendered.",
            "key": "landuse",
            "object_types": [
                "area"
            ],
            "value": "rocket_range"
        },
        {
            "description": "Rendered as landcover.",
            "key": "landuse",
            "object_types": [
                "area"
            ],
            "value": "salt_pond"
        },
        {
            "description": "Rendered as landcover.",
            "key": "natural",
            "object_types": [
                "area"
            ],
            "value": "sand"
        },
        {
            "description": "Rendered as landcover.",
            "key": "natural",
            "object_types": [
                "area"
            ],
            "value": "scree"
        },
        {
            "description": "Rendered as landcover.",
            "key": "natural",
            "object_types": [
                "area"
            ],
            "value": "scrub"
        },
        {
            "description": "Accepted as landcover, but not rendered.",
            "key": "natural",
            "object_types": [
                "area"
            ],
            "value": "sediment"
        },
        {
            "description": "Rendered as landcover.",
            "key": "natural",
            "object_types": [
                "area"
            ],
            "value": "shingle"
        },
        {
            "description": "Accepted as landcover, but not rendered.",
            "key": "landuse",
            "object_types": [
                "area"
            ],
            "value": "spoils"
        },
        {
            "description": "Accepted as landcover, but not rendered.",
            "key": "natural",
            "object_types": [
                "area"
            ],
            "value": "till"
        },
        {
            "description": "Rendered as landcover.",
            "key": "natural",
            "object_types": [
                "area"
            ],
            "value": "tundra"
        },
        {
            "description": "Rendered as landcover.",
            "key": "landuse",
            "object_types": [
                "area"
            ],